{
  "adjudication_executed": false,
  "authority_scope_id": "34551e904bafa71fb2fb6db33162e94ad41a08eca6c747d429c83760e09c1306",
  "complete_candidate_relation_set_hash": "81d975c4bd9dd6005bb7b657ad31acb1223d95a9ef2f8f4f0b7cac302db8d061",
  "complete_candidate_universe_hash": "02f64e7137a5d2a1049c8382f2858487f29235c991b559dee2a8f22ccf8b60d7",
  "execution_manifest_id": "9a76ac35974fe15fcac5031dff26576ed4fedd28bdbb4aece6302f8a7515b589",
  "initial_current_state": "NOT_STARTED_FOR_ADJUDICATION",
  "p0_prepared": true,
  "raw_execution_unit_id": "b66adb0766bcc22d9d0f5bb5c7d10cea650f2152095c42c4824f1f65d76e9aa3",
  "raw_identity_hash": "4094494ebf4be20b1ccbfa48efb27ff5f90e555b78f2c1becbb0ebf1804f93c2",
  "raw_key": "6000006::S08::A006",
  "schema": "RAW_EXECUTION_UNIT_CONTRACT_V1",
  "source_bundle_status": "FROZEN_REFERENCE_ONLY_NOT_RUNTIME_MATERIALIZED"
}
